<?xml version="1.0" ?>

<container xmlns="http://www.symfony-project.org/schema/dic/services"
    xmlns:xsi="http://www.w3.org/2001/XMLSchema-instance"
    xsi:schemaLocation="http://www.symfony-project.org/schema/dic/services http://www.symfony-project.org/schema/dic/services/services-1.0.xsd">

    <parameters>
        <parameter key="templating.engine.delegating.class">Symfony\Bundle\FrameworkBundle\Templating\DelegatingEngine</parameter>
        <parameter key="templating.name_parser.class">Symfony\Bundle\FrameworkBundle\Templating\TemplateNameParser</parameter>
        <parameter key="templating.cache_warmer.template_paths.class">Symfony\Bundle\FrameworkBundle\CacheWarmer\TemplatePathsCacheWarmer</parameter>
        <parameter key="templating.locator.class">Symfony\Bundle\FrameworkBundle\Templating\Loader\TemplateLocator</parameter>
        <parameter key="templating.locator.cached.class">Symfony\Bundle\FrameworkBundle\Templating\Loader\CachedTemplateLocator</parameter>
        <parameter key="templating.loader.filesystem.class">Symfony\Bundle\FrameworkBundle\Templating\Loader\FilesystemLoader</parameter>
        <parameter key="templating.loader.cache.class">Symfony\Component\Templating\Loader\CacheLoader</parameter>
        <parameter key="templating.loader.chain.class">Symfony\Component\Templating\Loader\ChainLoader</parameter>
        <parameter key="templating.assets.version">null</parameter>
        <parameter key="templating.assets.base_urls" type="collection"></parameter>
        <parameter key="debug.file_link_format">null</parameter>
    </parameters>

    <services>
        <service id="templating.engine.delegating" class="%templating.engine.delegating.class%" public="false">
            <argument type="service" id="service_container" />
            <argument type="collection" />
        </service>

        <service id="templating.name_parser" class="%templating.name_parser.class%">
            <argument type="service" id="kernel" />
        </service>

        <service id="templating.locator" class="%templating.locator.class%" public="false">
            <argument type="service" id="file_locator" />
            <argument>%kernel.root_dir%</argument>
        </service>

        <service id="templating.locator.cached" class="%templating.locator.cached.class%" public="false">
            <argument>%kernel.cache_dir%</argument>
        </service>

        <service id="templating.cache_warmer.template_paths" class="%templating.cache_warmer.template_paths.class%" public="false">
            <argument type="service" id="kernel" />
            <argument type="service" id="file_locator" />
            <argument type="service" id="templating.name_parser" />
            <argument>%kernel.root_dir%/views</argument>
        </service>

        <service id="templating.loader.filesystem" class="%templating.loader.filesystem.class%" public="false">
            <argument type="service" id="templating.locator" />
        </service>

        <service id="templating.loader.cache" class="%templating.loader.cache.class%" public="false">
            <argument type="service" id="templating.loader.wrapped" />
            <argument>%templating.loader.cache.path%</argument>
            <call method="setDebugger"><argument type="service" id="templating.debugger" on-invalid="ignore" /></call>
        </service>

        <service id="templating.loader.chain" class="%templating.loader.chain.class%" public="false">
            <call method="setDebugger"><argument type="service" id="templating.debugger" on-invalid="ignore" /></call>
        </service>

        <service id="templating.loader" alias="templating.loader.filesystem" />
    </services>
</container>
