<?xml version="1.0" encoding="utf-8"?>
<container xmlns="http://symfony.com/schema/dic/services" xmlns:xsi="http://www.w3.org/2001/XMLSchema-instance" xsi:schemaLocation="http://symfony.com/schema/dic/services https://symfony.com/schema/dic/services/services-1.0.xsd">
  <services>
    <service id="service_container" class="Symfony\Component\DependencyInjection\ContainerInterface" public="true" synthetic="true"/>
    <service id="foo_tagged_class_map" class="Bar" public="true">
      <argument type="tagged_class_map" tag="foo_tag"/>
    </service>
    <service id="foo2_tagged_class_map" class="Bar" public="true">
      <argument type="tagged_class_map" tag="foo_tag" index-by="key" exclude="baz"/>
    </service>
    <service id="foo3_tagged_class_map" class="Bar" public="true">
      <argument type="tagged_class_map" tag="foo_tag">
        <exclude>baz</exclude>
        <exclude>qux</exclude>
      </argument>
    </service>
  </services>
</container>
