<?xml version="1.0" ?>

<container xmlns="http://symfony.com/schema/dic/services"
    xmlns:xsi="http://www.w3.org/2001/XMLSchema-instance"
    xsi:schemaLocation="http://symfony.com/schema/dic/services http://symfony.com/schema/dic/services/services-1.0.xsd">

    <parameters>
        <parameter key="debug.toolbar.class">Symfony\Bundle\WebProfilerBundle\WebDebugToolbarListener</parameter>
        <parameter key="debug.toolbar.intercept_redirects">false</parameter>
    </parameters>

    <services>
        <service id="debug.toolbar" class="%debug.toolbar.class%">
            <tag name="kernel.listener" event="onCoreResponse" priority="-128" />
            <argument type="service" id="templating.engine.twig" />
            <argument>%debug.toolbar.intercept_redirects%</argument>
        </service>
    </services>
</container>
