<?xml version="1.0" encoding="UTF-8"?>

<container xmlns="http://symfony.com/schema/dic/services"
    xmlns:xsi="http://www.w3.org/2001/XMLSchema-instance"
    xsi:schemaLocation="http://symfony.com/schema/dic/services http://symfony.com/schema/dic/services/services-1.0.xsd">

    <services>
        <defaults public="false" />

        <service id="security.acl.dbal.connection" alias="database_connection" public="true" />

        <service id="security.acl.dbal.provider" class="Symfony\Component\Security\Acl\Dbal\MutableAclProvider">
            <argument type="service" id="security.acl.dbal.connection" />
            <argument type="service" id="security.acl.permission_granting_strategy" />
            <argument type="collection">
                <argument key="class_table_name">%security.acl.dbal.class_table_name%</argument>
                <argument key="entry_table_name">%security.acl.dbal.entry_table_name%</argument>
                <argument key="oid_table_name">%security.acl.dbal.oid_table_name%</argument>
                <argument key="oid_ancestors_table_name">%security.acl.dbal.oid_ancestors_table_name%</argument>
                <argument key="sid_table_name">%security.acl.dbal.sid_table_name%</argument>
            </argument>
            <argument type="service" id="security.acl.cache" on-invalid="null" />
        </service>

        <service id="security.acl.dbal.schema" class="Symfony\Component\Security\Acl\Dbal\Schema" public="true">
            <argument type="collection">
                <argument key="class_table_name">%security.acl.dbal.class_table_name%</argument>
                <argument key="entry_table_name">%security.acl.dbal.entry_table_name%</argument>
                <argument key="oid_table_name">%security.acl.dbal.oid_table_name%</argument>
                <argument key="oid_ancestors_table_name">%security.acl.dbal.oid_ancestors_table_name%</argument>
                <argument key="sid_table_name">%security.acl.dbal.sid_table_name%</argument>
            </argument>
            <argument type="service" id="security.acl.dbal.connection" />
        </service>
        <service id="security.acl.dbal.schema_listener" class="Symfony\Bundle\SecurityBundle\EventListener\AclSchemaListener">
            <argument type="service" id="security.acl.dbal.schema" />
        </service>

        <service id="security.acl.provider" alias="security.acl.dbal.provider" public="true" />
        <service id="Symfony\Component\Security\Acl\Model\AclProviderInterface" alias="security.acl.provider" />

        <service id="security.acl.cache.doctrine" class="Symfony\Component\Security\Acl\Domain\DoctrineAclCache">
            <argument type="service" id="security.acl.cache.doctrine.cache_impl" />
            <argument type="service" id="security.acl.permission_granting_strategy" />
        </service>

        <service id="security.acl.cache.doctrine.cache_impl" alias="doctrine.orm.default_result_cache" />
    </services>
</container>
